[
  {
    "id": "vestaboard_flagship",
    "label": "Vestaboard Flagship",
    "technology": "split_flap",
    "family": "vestaboard",
    "geometry": {
      "kind": "cells",
      "rows": 6,
      "cols": 22
    },
    "color": {
      "kind": "tiles"
    },
    "charset": "vestaboard_v1",
    "charsetByCode62": {
      "degree": "vestaboard_v1",
      "heart": "vestaboard_v2"
    },
    "animation": {
      "delivery": "none",
      "maxFps": 0,
      "notes": "The hardware cascades by itself (~16 ms per flap at 60 RPM); a client sends one message, never frames.",
      "sources": []
    },
    "appearance": {
      "boardColors": [
        "black",
        "white"
      ],
      "options": {
        "board_color": [
          "black",
          "white"
        ]
      }
    },
    "legacy": {
      "deviceType": "flagship"
    }
  },
  {
    "id": "vestaboard_note",
    "label": "Vestaboard Note",
    "technology": "split_flap",
    "family": "vestaboard",
    "geometry": {
      "kind": "cells",
      "rows": 3,
      "cols": 15
    },
    "color": {
      "kind": "tiles"
    },
    "charset": "vestaboard_v2",
    "animation": {
      "delivery": "none",
      "maxFps": 0,
      "notes": "The hardware cascades by itself (~16 ms per flap at 60 RPM); a client sends one message, never frames.",
      "sources": []
    },
    "appearance": {
      "boardColors": [
        "black",
        "white"
      ],
      "options": {
        "board_color": [
          "black",
          "white"
        ]
      }
    },
    "legacy": {
      "deviceType": "note"
    }
  },
  {
    "id": "vestaboard_note_array",
    "label": "Vestaboard Note array",
    "technology": "split_flap",
    "family": "vestaboard",
    "geometry": {
      "kind": "note_array"
    },
    "color": {
      "kind": "tiles"
    },
    "charset": "vestaboard_v2",
    "animation": {
      "delivery": "none",
      "maxFps": 0,
      "notes": "The hardware cascades by itself (~16 ms per flap at 60 RPM); a client sends one message, never frames.",
      "sources": []
    },
    "appearance": {
      "boardColors": [
        "black",
        "white"
      ],
      "options": {
        "board_color": [
          "black",
          "white"
        ]
      }
    },
    "legacy": {
      "deviceType": "note_array"
    }
  }
]
